<?xml version="1.0" encoding="UTF-8"?>
<tns:algorithm xmlns:tns="http://www.example.org/OneIdSchema" xmlns:xsi="http://www.w3.org/2001/XMLSchema-instance" xsi:schemaLocation="http://www.example.org/OneIdSchema cooperation.xsd ">
  <tns:name>tns:name</tns:name>
  <tns:effort>
    <tns:result>
      <tns:name>tns:name</tns:name>
      <tns:outcome>
        <tns:name>tns:name</tns:name>
      </tns:outcome>
    </tns:result>
  </tns:effort>
  <tns:outcome>
    <tns:name>tns:name</tns:name>
  </tns:outcome>
  <tns:reward>
    <tns:name>tns:name</tns:name>
  </tns:reward>
</tns:algorithm>
